{
  "learner_id": "33333333-3333-4333-8333-333333333333",
  "session_id": "cccccccc-cccc-4ccc-8ccc-cccccccccccc",
  "decision_cycle_id": "dddddddd-dddd-4ddd-8ddd-dddddddddddd",
  "profile_snapshot_id": "fc111111-1111-4111-8111-111111111111",
  "assessment_attempt_id": null,
  "behavior_summary_id": "fd411111-1111-4111-8111-111111111111",
  "program_target_node_ids": [
    "linked_list_pointer",
    "linked_list_reverse"
  ],
  "evidence_ids": [
    "fd111111-1111-4111-8111-111111111111"
  ]
}
